{
  "schemaVersion": "channel-protocol-fixture/v1",
  "id": "onebot11.outbound.get-group-message.live.v1",
  "channel": "onebot11",
  "direction": "outbound",
  "capability": "get-group-message",
  "status": "tested-supported",
  "capturedAt": "2026-10-27T14:18:17.077Z",
  "provenance": {
    "kind": "real-api-capture",
    "source": "tools/channel-fixtures/probe-napcat.mjs",
    "testRunId": "ca251924-4ff3-4cd8-a05b-50c748895570"
  },
  "environment": {
    "provider": "napcat",
    "adapterVersion": "4.18.19",
    "transport": "websocket",
    "nodeVersion": "v24.18.0",
    "runtimeCommit": "54f0fbf75c3925456236a98d9fcbc8a36b9caa13",
    "documentation": "https://napneko.github.io/api/4.18.19",
    "messagePostFormat": "array"
  },
  "redactions": [
    "账号、群、消息、文件标识使用稳定占位符",
    "昵称、路径、签名 URL、令牌和文件内容已脱敏",
    "仅记录带本轮测试标记的消息"
  ],
  "artifacts": {
    "platformRequest": {
      "action": "get_msg",
      "params": {
        "message_id": "<message-7>"
      },
      "echo": "<request-1>"
    },
    "platformResponse": {
      "status": "ok",
      "retcode": 0,
      "data": {
        "self_id": "<bot-3>",
        "user_id": "<bot-3>",
        "time": 1793110697,
        "message_id": "<message-7>",
        "message_seq": "<message-7>",
        "real_id": "<message-7>",
        "real_seq": "<message-sequence>",
        "message_type": "group",
        "sender": {
          "user_id": "<bot-3>",
          "nickname": "<nickname>",
          "card": "<card>",
          "role": "member"
        },
        "raw_message": "fixture protocol text group 中文 &amp; &#91;text&#93;",
        "font": 14,
        "sub_type": "normal",
        "message": [
          {
            "type": "text",
            "data": {
              "text": "fixture protocol text group 中文 & [text]"
            }
          }
        ],
        "message_format": "array",
        "post_type": "message_sent",
        "message_sent_type": "self",
        "group_id": "<group-1>",
        "group_name": "<group_name>",
        "emoji_likes_list": []
      },
      "message": "[REDACTED]",
      "wording": "[REDACTED]",
      "echo": "<request-1>",
      "stream": "normal-action"
    }
  },
  "conclusion": "发送回执的消息标识应可用于查询，查询内容需含本轮专用测试标记",
  "limitations": []
}
