{
  "schemaVersion": "channel-protocol-fixture/v1",
  "id": "onebot11.outbound.recall-group-7.live.v1",
  "channel": "onebot11",
  "direction": "outbound",
  "capability": "recall-group-7",
  "status": "tested-supported",
  "capturedAt": "2026-10-27T14:19:33.237Z",
  "provenance": {
    "kind": "real-api-capture",
    "source": "tools/channel-fixtures/probe-napcat.mjs",
    "testRunId": "7f666d7b-3272-4159-89ba-f17157299655"
  },
  "environment": {
    "provider": "napcat",
    "adapterVersion": "4.18.19",
    "transport": "websocket",
    "nodeVersion": "v24.18.0",
    "runtimeCommit": "54f0fbf75c3925456236a98d9fcbc8a36b9caa13",
    "documentation": "https://napneko.github.io/api/4.18.19",
    "messagePostFormat": "array"
  },
  "redactions": [
    "账号、群、消息、文件标识使用稳定占位符",
    "昵称、路径、签名 URL、令牌和文件内容已脱敏",
    "仅记录带本轮测试标记的消息"
  ],
  "artifacts": {
    "platformRequest": {
      "action": "delete_msg",
      "params": {
        "message_id": "<message-9>"
      },
      "echo": "<request-1>"
    },
    "platformResponse": {
      "status": "ok",
      "retcode": 0,
      "data": null,
      "message": "",
      "wording": "",
      "echo": "<request-1>",
      "stream": "normal-action"
    }
  },
  "conclusion": "仅撤回历史中含专用测试标记的消息，平台成功回执与客户端消失需分别确认",
  "limitations": []
}
