{
  "schemaVersion": "channel-protocol-fixture/v1",
  "id": "onebot11.inbound.history-private-input-1.live.v1",
  "channel": "onebot11",
  "direction": "inbound",
  "capability": "history-private-input-1",
  "status": "tested-supported",
  "capturedAt": "2026-10-27T14:22:33.206Z",
  "provenance": {
    "kind": "real-api-capture",
    "source": "tools/channel-fixtures/probe-napcat.mjs",
    "testRunId": "63157034-979c-435a-abef-57eee19a507d"
  },
  "environment": {
    "provider": "napcat",
    "adapterVersion": "4.18.19",
    "transport": "websocket",
    "nodeVersion": "v24.18.0",
    "runtimeCommit": "54f0fbf75c3925456236a98d9fcbc8a36b9caa13",
    "documentation": "https://napneko.github.io/api/4.18.19",
    "messagePostFormat": "array"
  },
  "redactions": [
    "账号、群、消息、文件标识使用稳定占位符",
    "昵称、路径、签名 URL、令牌和文件内容已脱敏",
    "仅记录带本轮测试标记的消息"
  ],
  "artifacts": {
    "platformEvent": {
      "self_id": "<account-3>",
      "user_id": "<user-1>",
      "time": 1793110838,
      "message_id": "<message-4>",
      "message_seq": "<message-4>",
      "real_id": "<message-4>",
      "real_seq": "<message-sequence>",
      "message_type": "private",
      "sender": {
        "user_id": "<user-1>",
        "nickname": "<nickname>",
        "card": "<card>"
      },
      "raw_message": "fixture protocol text 输入测试",
      "font": 14,
      "sub_type": "friend",
      "message": [
        {
          "type": "text",
          "data": {
            "text": "fixture protocol text 输入测试"
          }
        }
      ],
      "message_format": "array",
      "post_type": "message"
    }
  },
  "conclusion": "测试账号输入由真实历史查询返回，可用于验证消息字段和归一化；不能作为 WebSocket 推送到达的证据",
  "limitations": ["来源为历史查询中的消息快照；推送时序、重连和丢失恢复尚未验证"]
}
