{
  "schemaVersion": "channel-protocol-fixture/v1",
  "id": "onebot11.outbound.send-private-text.live.v1",
  "channel": "onebot11",
  "direction": "outbound",
  "capability": "send-private-text",
  "status": "tested-supported",
  "capturedAt": "2026-10-27T14:18:15.078Z",
  "provenance": {
    "kind": "real-api-capture",
    "source": "tools/channel-fixtures/probe-napcat.mjs",
    "testRunId": "ca251924-4ff3-4cd8-a05b-50c748895570"
  },
  "environment": {
    "provider": "napcat",
    "adapterVersion": "4.18.19",
    "transport": "websocket",
    "nodeVersion": "v24.18.0",
    "runtimeCommit": "54f0fbf75c3925456236a98d9fcbc8a36b9caa13",
    "documentation": "https://napneko.github.io/api/4.18.19",
    "messagePostFormat": "array"
  },
  "redactions": [
    "账号、群、消息、文件标识使用稳定占位符",
    "昵称、路径、签名 URL、令牌和文件内容已脱敏",
    "仅记录带本轮测试标记的消息"
  ],
  "artifacts": {
    "platformRequest": {
      "action": "send_msg",
      "params": {
        "user_id": "<user-1>",
        "message_type": "private",
        "message": "fixture protocol text private 中文 & [text]",
        "auto_escape": false
      },
      "echo": "<request-1>"
    },
    "platformResponse": {
      "status": "ok",
      "retcode": 0,
      "data": {
        "message_id": "<message-4>"
      },
      "message": "[REDACTED]",
      "wording": "[REDACTED]",
      "echo": "<request-1>",
      "stream": "normal-action"
    }
  },
  "conclusion": "验证适配器实际使用的 send_msg、字符串 CQ 编码和数字字符串目标标识；成功回执仅证明平台接受",
  "limitations": ["接收端渲染与用户阅读需要人工确认"]
}
