{
  "schemaVersion": "channel-protocol-fixture/v1",
  "id": "onebot11.outbound.get-status.live.v1",
  "channel": "onebot11",
  "direction": "outbound",
  "capability": "get-status",
  "status": "tested-supported",
  "capturedAt": "2026-10-27T14:18:14.832Z",
  "provenance": {
    "kind": "real-api-capture",
    "source": "tools/channel-fixtures/probe-napcat.mjs",
    "testRunId": "ca251924-4ff3-4cd8-a05b-50c748895570"
  },
  "environment": {
    "provider": "napcat",
    "adapterVersion": "4.18.19",
    "transport": "websocket",
    "nodeVersion": "v24.18.0",
    "runtimeCommit": "54f0fbf75c3925456236a98d9fcbc8a36b9caa13",
    "documentation": "https://napneko.github.io/api/4.18.19",
    "messagePostFormat": "array"
  },
  "redactions": [
    "账号、群、消息、文件标识使用稳定占位符",
    "昵称、路径、签名 URL、令牌和文件内容已脱敏",
    "仅记录带本轮测试标记的消息"
  ],
  "artifacts": {
    "platformRequest": {
      "action": "get_status",
      "params": {},
      "echo": "<request-1>"
    },
    "platformResponse": {
      "status": "ok",
      "retcode": 0,
      "data": {
        "online": true,
        "good": true,
        "stat": {}
      },
      "message": "[REDACTED]",
      "wording": "[REDACTED]",
      "echo": "<request-1>",
      "stream": "normal-action"
    }
  },
  "conclusion": "文档预期 online/good 为运行状态；WebSocket 建连本身不能证明 QQ 在线",
  "limitations": []
}
