{
  "schemaVersion": "channel-protocol-fixture/v1",
  "id": "qq-official.inbound.group-at-text.documented.v1",
  "channel": "qq-official",
  "direction": "inbound",
  "capability": "message.receive.group-at.text",
  "status": "documented",
  "capturedAt": "2026-07-19T00:00:00.000Z",
  "provenance": {
    "kind": "official-documentation",
    "source": "https://bot.q.qq.com/wiki/develop/api-v2/server-inter/message/send-receive/event.html"
  },
  "environment": {
    "provider": "qq-official",
    "adapterVersion": "official-docs-updated-2026-06-23",
    "transport": "webhook-or-websocket",
    "runtimeCommit": "not-applicable"
  },
  "redactions": ["All openids and message identifiers are stable placeholders."],
  "artifacts": {
    "platformEvent": {
      "id": "<event-1>",
      "op": 0,
      "s": 42,
      "t": "GROUP_AT_MESSAGE_CREATE",
      "d": {
        "author": { "member_openid": "<member-openid-1>", "member_role": "member", "bot": false },
        "content": " fixture text",
        "group_openid": "<group-openid-1>",
        "id": "<message-1>",
        "timestamp": "2026-07-19T08:00:00+08:00"
      }
    }
  },
  "conclusion": "QQ Official documents GROUP_AT_MESSAGE_CREATE with member_openid, group_openid, message id and RFC3339 timestamp.",
  "limitations": ["Documentation example only; webhook and websocket payload differences require real capture."]
}
