{
  "schemaVersion": "channel-protocol-fixture/v1",
  "id": "onebot11.outbound.get-version-info.live.v1",
  "channel": "onebot11",
  "direction": "outbound",
  "capability": "get-version-info",
  "status": "tested-supported",
  "capturedAt": "2026-10-27T14:22:33.189Z",
  "provenance": {
    "kind": "real-api-capture",
    "source": "tools/channel-fixtures/probe-napcat.mjs",
    "testRunId": "63157034-979c-435a-abef-57eee19a507d"
  },
  "environment": {
    "provider": "napcat",
    "adapterVersion": "4.18.19",
    "transport": "websocket",
    "nodeVersion": "v24.18.0",
    "runtimeCommit": "54f0fbf75c3925456236a98d9fcbc8a36b9caa13",
    "documentation": "https://napneko.github.io/api/4.18.19",
    "messagePostFormat": "array"
  },
  "redactions": [
    "账号、群、消息、文件标识使用稳定占位符",
    "昵称、路径、签名 URL、令牌和文件内容已脱敏",
    "仅记录带本轮测试标记的消息"
  ],
  "artifacts": {
    "platformRequest": {
      "action": "get_version_info",
      "params": {},
      "echo": "<request-1>"
    },
    "platformResponse": {
      "status": "ok",
      "retcode": 0,
      "data": {
        "app_name": "NapCat.Onebot",
        "protocol_version": "v11",
        "app_version": "4.18.19"
      },
      "message": "",
      "wording": "",
      "echo": "<request-1>",
      "stream": "normal-action"
    }
  },
  "conclusion": "以部署返回的版本定位实测范围，不能用文档最新版本代替部署版本",
  "limitations": []
}
